{
  "schemaVersion": "1.0.0",
  "model": "claude-opus-5-5",
  "interpretedAt": "2026-10-17T14:31:40Z",
  "image": {
    "width": 3024,
    "height": 4032
  },
  "reading": {
    "isFloorPlan": false,
    "problem": "The photo shows a kitchen, not a drawing of a floor plan.",
    "dimensionUnits": "none",
    "ceilingHeightMm": null,
    "rooms": [],
    "dimensions": []
  }
}
